<?xml version="1.0" encoding="UTF-8"?>

<!ENTITY % gui_items        "(xi:include|category|indexedCategory|constant|floatOption|intOption|bitmaskOption|choiceOption|binaryOption|irqOption|stringOption|numericListOption|pinListOption|aliasOption|signals)" >
<!ENTITY % structure_items  "(xi:include|section|list)" >
<!ENTITY % control_items    "(xi:include|template|validate|projectActionList)" >

<!-- Include another file -->
<!ELEMENT xi:include EMPTY>
   <!ATTLIST xi:include href      CDATA        #REQUIRED>

<!-- Root fileElement -->
<!ELEMENT peripheralPage ((%structure_items;|%gui_items;|%control_items;)*) >
   <!ATTLIST peripheralPage xmlns:xi     CDATA        #IMPLIED>
   <!ATTLIST peripheralPage name         CDATA        #REQUIRED>
   <!ATTLIST peripheralPage description  CDATA        #REQUIRED>
   <!ATTLIST peripheralPage toolTip      CDATA        #IMPLIED>

<!ELEMENT fragment ANY >
   <!ATTLIST fragment xmlns:xi CDATA #IMPLIED>

<!ELEMENT list (((%structure_items;),(%control_items;)*)|(%gui_items;|%control_items;)*) >
   <!ATTLIST list name         CDATA        #IMPLIED>
   <!ATTLIST list description  CDATA        #IMPLIED>

<!ELEMENT section (((%structure_items;),(%control_items;)*)|(%gui_items;|%control_items;)*) >
   <!ATTLIST section name         CDATA        #IMPLIED>

<!ELEMENT indexedCategory ((%gui_items;)*) >
   <!ATTLIST indexedCategory xmlns:xi     CDATA        #IMPLIED>
   <!ATTLIST indexedCategory name         ID           #REQUIRED>
   <!ATTLIST indexedCategory description  CDATA        #REQUIRED>
   <!ATTLIST indexedCategory toolTip      CDATA        #IMPLIED>
   <!ATTLIST indexedCategory dim          CDATA        #REQUIRED>
   <!ATTLIST indexedCategory value        CDATA        #IMPLIED>
   <!ATTLIST indexedCategory constant     (false|true) #IMPLIED>

<!ELEMENT category ((%gui_items;|template)*) >
   <!ATTLIST category  constant     (false|true) #IMPLIED>
   <!ATTLIST category  xmlns:xi     CDATA        #IMPLIED>
   <!ATTLIST category  name         CDATA        #REQUIRED>
   <!ATTLIST category  key          CDATA        #IMPLIED>
   <!ATTLIST category  description  CDATA        #REQUIRED>
   <!ATTLIST category  toolTip      CDATA        #IMPLIED>
   <!ATTLIST category  derived      (false|true) #IMPLIED>

<!ELEMENT intOption (for?) >
   <!ATTLIST intOption constant     (false|true)  #IMPLIED>
   <!ATTLIST intOption hidden       (false|true)  #IMPLIED>
   <!ATTLIST intOption name          ID           #REQUIRED>
   <!ATTLIST intOption key           CDATA        #IMPLIED>
   <!ATTLIST intOption origin        CDATA        #IMPLIED>
   <!ATTLIST intOption description   CDATA        #IMPLIED>
   <!ATTLIST intOption toolTip       CDATA        #IMPLIED>
   <!ATTLIST intOption disabledValue CDATA        #IMPLIED>
   <!ATTLIST intOption value         CDATA        #IMPLIED>
   <!ATTLIST intOption units         (None|Hz|s)  #IMPLIED>
   <!ATTLIST intOption step          CDATA        "1">
   <!-- Minimum value (displayed value) -->
   <!ATTLIST intOption min           CDATA        #IMPLIED>
   <!-- Maximum value (displayed value) -->
   <!ATTLIST intOption max           CDATA        #IMPLIED>
   <!-- Offset to translate from displayed value to substitution value -->
   <!ATTLIST intOption offset        CDATA        #IMPLIED>
   <!ATTLIST intOption indexedBy     CDATA        #IMPLIED>
   <!ATTLIST intOption derived       (false|true) #IMPLIED>
   <!ATTLIST intOption derivedFrom   IDREF        #IMPLIED>
  
<!ELEMENT bitmaskOption EMPTY >
   <!ATTLIST bitmaskOption constant       (false|true) #IMPLIED>
   <!ATTLIST bitmaskOption hidden         (false|true) #IMPLIED>
   <!ATTLIST bitmaskOption name           ID           #REQUIRED>
   <!ATTLIST bitmaskOption key            CDATA        #IMPLIED>
   <!ATTLIST bitmaskOption origin         CDATA        #IMPLIED>
   <!ATTLIST bitmaskOption description    CDATA        #IMPLIED>
   <!ATTLIST bitmaskOption toolTip        CDATA        #IMPLIED>
   <!ATTLIST bitmaskOption value          CDATA        #IMPLIED>
   <!ATTLIST bitmaskOption disabledValue  CDATA        #IMPLIED>
   <!ATTLIST bitmaskOption bitmask        CDATA        "0xFFFF">
   <!ATTLIST bitmaskOption bitList        CDATA        "">
   <!ATTLIST bitmaskOption indexedBy      CDATA        #IMPLIED>
   <!ATTLIST bitmaskOption derived        (false|true) #IMPLIED>
   <!ATTLIST bitmaskOption derivedFrom    IDREF        #IMPLIED>
  
<!ELEMENT floatOption (for?) >
   <!ATTLIST floatOption constant      (false|true) #IMPLIED>
   <!ATTLIST floatOption hidden        (false|true) #IMPLIED>
   <!ATTLIST floatOption name          ID           #REQUIRED>
   <!ATTLIST floatOption key           CDATA        #IMPLIED>
   <!ATTLIST floatOption origin        CDATA        #IMPLIED>
   <!ATTLIST floatOption description   CDATA        #IMPLIED>
   <!ATTLIST floatOption toolTip       CDATA        #IMPLIED>
   <!ATTLIST floatOption value         CDATA        #IMPLIED>
   <!ATTLIST floatOption disabledValue CDATA        #IMPLIED>
   <!ATTLIST floatOption units         (None|Hz|s)  #IMPLIED>
   <!-- Minimum value (displayed value) -->
   <!ATTLIST floatOption min           CDATA        #IMPLIED>
   <!-- Maximum value (displayed value) -->
   <!ATTLIST floatOption max           CDATA        #IMPLIED>
   <!ATTLIST floatOption derived       (false|true) #IMPLIED>
   <!ATTLIST floatOption derivedFrom   IDREF        #IMPLIED>
  
<!ELEMENT aliasOption EMPTY >
   <!-- alias Option 
   name 		Refers to another option within the same file and will be used as key and validated as a reference to an ID
   key  		Allows reference to an option (possibly) in another file while passing validation
   displayName	Allows the name of the model (visible in the GUI) to differ from the aliased option's name
   -->
   <!ATTLIST aliasOption name        IDREF        #IMPLIED>
   <!ATTLIST aliasOption key         CDATA        #IMPLIED>
   <!ATTLIST aliasOption displayName CDATA        #IMPLIED>
   <!ATTLIST aliasOption description CDATA        #IMPLIED>
   <!ATTLIST aliasOption toolTip     CDATA        #IMPLIED>
   <!ATTLIST aliasOption constant    (false|true) "true">
   <!ATTLIST aliasOption optional    (false|true) #IMPLIED>

<!ELEMENT stringOption (for?) >
   <!ATTLIST stringOption constant      (false|true) #IMPLIED>
   <!ATTLIST binaryOption hidden        (false|true) #IMPLIED>
   <!ATTLIST stringOption name          ID           #REQUIRED>
   <!ATTLIST stringOption key           CDATA        #IMPLIED>
   <!ATTLIST stringOption origin        CDATA        #IMPLIED>
   <!ATTLIST stringOption description   CDATA        #IMPLIED>
   <!ATTLIST stringOption toolTip       CDATA        #IMPLIED>
   <!ATTLIST stringOption value         CDATA        #IMPLIED>
   <!ATTLIST stringOption disabledValue CDATA        #IMPLIED>
   <!ATTLIST stringOption indexedBy     CDATA        #IMPLIED>
   <!ATTLIST stringOption derived       (false|true) #IMPLIED>
   <!ATTLIST stringOption derivedFrom   IDREF        #IMPLIED>
  
<!ELEMENT numericListOption (for?) >
   <!ATTLIST numericListOption constant      (false|true) #IMPLIED>
   <!ATTLIST numericListOption hidden        (false|true) #IMPLIED>
   <!ATTLIST numericListOption name          ID           #REQUIRED>
   <!ATTLIST numericListOption key           CDATA        #IMPLIED>
   <!ATTLIST numericListOption origin        CDATA        #IMPLIED>
   <!ATTLIST numericListOption description   CDATA        #IMPLIED>
   <!ATTLIST numericListOption toolTip       CDATA        #IMPLIED>
   <!ATTLIST numericListOption value         CDATA        #IMPLIED>
   <!ATTLIST numericListOption disabledValue CDATA        #IMPLIED>
   <!ATTLIST numericListOption size          CDATA        #IMPLIED>
   <!ATTLIST numericListOption min           CDATA        #IMPLIED>
   <!ATTLIST numericListOption max           CDATA        #IMPLIED>
   <!ATTLIST numericListOption indexedBy     CDATA        #IMPLIED>
   <!ATTLIST numericListOption derived       (false|true) #IMPLIED>
   <!ATTLIST numericListOption derivedFrom   IDREF        #IMPLIED>
  
<!ELEMENT pinListOption (for?) >
   <!ATTLIST pinListOption constant      (false|true) #IMPLIED>
   <!ATTLIST pinListOption hidden        (false|true) #IMPLIED>
   <!ATTLIST pinListOption name          ID           #REQUIRED>
   <!ATTLIST pinListOption key           CDATA        #IMPLIED>
   <!ATTLIST pinListOption origin        CDATA        #IMPLIED>
   <!ATTLIST pinListOption description   CDATA        #IMPLIED>
   <!ATTLIST pinListOption toolTip       CDATA        #IMPLIED>
   <!ATTLIST pinListOption value         CDATA        #IMPLIED>
   <!ATTLIST bitmaskOption disabledValue CDATA        #IMPLIED>
   <!ATTLIST pinListOption size          CDATA        #IMPLIED>
   <!ATTLIST pinListOption indexedBy     CDATA        #IMPLIED>
   <!ATTLIST pinListOption derived       (false|true) #IMPLIED>
   <!ATTLIST pinListOption derivedFrom   IDREF        #IMPLIED>
   
<!ELEMENT choiceOption (for?, (choice)*) >
   <!ATTLIST choiceOption constant            (false|true) #IMPLIED>
   <!ATTLIST choiceOption hidden              (false|true) #IMPLIED>
   <!ATTLIST choiceOption name                ID           #IMPLIED>
   <!ATTLIST choiceOption key                 CDATA        #IMPLIED>
   <!ATTLIST choiceOption origin              CDATA        #IMPLIED>
   <!ATTLIST choiceOption description         CDATA        #IMPLIED>
   <!ATTLIST choiceOption toolTip             CDATA        #IMPLIED>
   <!ATTLIST choiceOption units               (None|Hz|s)  #IMPLIED>
   <!ATTLIST choiceOption indexedBy           CDATA        #IMPLIED>
   <!ATTLIST choiceOption derived             (false|true) #IMPLIED>
   <!ATTLIST choiceOption derivedFrom         IDREF        #IMPLIED>
  
<!ELEMENT choice EMPTY >
   <!ATTLIST choice value                     CDATA        #REQUIRED>
   <!ATTLIST choice name                      CDATA        #REQUIRED>
   <!ATTLIST choice requiresPeripheral        CDATA        #IMPLIED>
   <!ATTLIST choice isDefault                 (false|true) #IMPLIED>

<!ELEMENT binaryOption (for?, choice, choice)? >
   <!ATTLIST binaryOption constant      (false|true) #IMPLIED>
   <!ATTLIST binaryOption hidden        (false|true) #IMPLIED>
   <!ATTLIST binaryOption disabledValue CDATA        #IMPLIED>
   <!ATTLIST binaryOption name          ID           #IMPLIED>
   <!ATTLIST binaryOption key           CDATA        #IMPLIED>
   <!ATTLIST binaryOption origin        CDATA        #IMPLIED>
   <!ATTLIST binaryOption description   CDATA        #IMPLIED>
   <!ATTLIST binaryOption toolTip       CDATA        #IMPLIED>
   <!ATTLIST binaryOption indexedBy     CDATA        #IMPLIED>
   <!ATTLIST binaryOption derived       (false|true) #IMPLIED>
   <!ATTLIST binaryOption derivedFrom   IDREF        #IMPLIED>

<!ELEMENT irqOption EMPTY >
   <!ATTLIST irqOption constant      (false|true) #IMPLIED>
   <!ATTLIST irqOption hidden        (false|true) #IMPLIED>
   <!ATTLIST irqOption name          ID           #REQUIRED>
   <!ATTLIST irqOption key           CDATA        #IMPLIED>
   <!ATTLIST irqOption pattern       CDATA        #REQUIRED>
   <!ATTLIST irqOption classHandler  CDATA        #REQUIRED>
   <!ATTLIST irqOption value         CDATA        #IMPLIED>
   <!ATTLIST irqOption disabledValue CDATA        #IMPLIED>
   <!ATTLIST irqOption origin        CDATA        #IMPLIED>
   <!ATTLIST irqOption description   CDATA        #IMPLIED>
   <!ATTLIST irqOption toolTip       CDATA        #IMPLIED>
   <!ATTLIST irqOption derived       (false|true) #IMPLIED>
   <!ATTLIST irqOption derivedFrom   IDREF        #IMPLIED>

<!ELEMENT template (#PCDATA|for)* >
   <!ATTLIST template namespace (info|usbdm|class|all)  "info" >
   <!ATTLIST template name 		CDATA  					"" >
   <!ATTLIST template dim  		CDATA  					"0" >

<!ELEMENT for (#PCDATA|for)* >
   <!ATTLIST for var         CDATA #REQUIRED >
   <!ATTLIST for enumeration CDATA #REQUIRED >

<!ELEMENT validate (param*) >
   <!ATTLIST validate class CDATA #REQUIRED>
   <!ATTLIST validate dim  		   CDATA        "0" >
   
<!ELEMENT param EMPTY >
   <!ATTLIST param type  (long|string) #REQUIRED>
   <!ATTLIST param value CDATA         #REQUIRED>

<!ELEMENT signals EMPTY >
   <!ATTLIST signals name        CDATA "" >
   <!ATTLIST signals optional    (false|true) #IMPLIED>

<!-- List of actions to be applied to a project -->
<!ELEMENT projectActionList ((deleteResource|copy|constant)*) >
   <!ATTLIST projectActionList id          ID            #REQUIRED>
   <!ATTLIST projectActionList root        CDATA         #IMPLIED>
   <!ATTLIST projectActionList doOnceOnly  (true|false)  "true">
   
<!-- Exclude/include source file in Eclipse project -->
<!ELEMENT excludeSourceFile EMPTY >
   <!ATTLIST excludeSourceFile target  CDATA         #REQUIRED>
   <!ATTLIST excludeSourceFile excluded (true|false) "true" >

<!-- Exclude/include source folder in Eclipse project -->
<!ELEMENT excludeSourceFolder EMPTY >
   <!ATTLIST excludeSourceFolder target  CDATA         #REQUIRED>
   <!ATTLIST excludeSourceFolder excluded (true|false) "true" >

<!-- Remove file from Eclipse project -->
<!ELEMENT deleteResource EMPTY >
   <!ATTLIST deleteResource target  CDATA         #REQUIRED>

 <!ELEMENT createFolder EMPTY >
   <!ATTLIST createFolder target  CDATA #REQUIRED>
   <!ATTLIST createFolder type    (source|include|normal) "normal">

<!-- File to be copied to a project -->
<!ELEMENT copy EMPTY >
   <!ATTLIST copy source               CDATA #REQUIRED>
   <!ATTLIST copy target               CDATA #REQUIRED>
   <!ATTLIST copy type                 CDATA #IMPLIED>
   <!ATTLIST copy sourcePathType       (absolute|relative|unknown) #IMPLIED>
   <!ATTLIST copy macroReplace         (true|false) "true">
   <!ATTLIST copy overwrite            (true|false) #IMPLIED>
   <!ATTLIST copy derived              (true|false) #IMPLIED>
   
<!ELEMENT constant EMPTY >
   <!-- constant 
   key       Allows specification of a explicit key rather than based upon the name.
   name      In the absence of a key it is used to create a key tied to the current peripheral/file. 
             Used as visible name in GUI (model)
             Supports validation as an ID.
   weak	     If true indicates the constant may already exist and this constant is discarded
   overwrite Replaces any existing constant of the same key
   -->
   <!ATTLIST constant name         ID           #IMPLIED>
   <!ATTLIST constant key          CDATA        #IMPLIED>
   <!ATTLIST constant value        CDATA        #REQUIRED>
   <!ATTLIST constant type         (boolean|int|string)  "string" >
   <!ATTLIST constant weak         (true|false)          #IMPLIED>
   <!ATTLIST constant replace      (true|false)          #IMPLIED>
   <!ATTLIST constant derived      (true|false)          #IMPLIED>
   
<!ELEMENT divider EMPTY >
   
