<?xml version="1.0" encoding="UTF-8"?>
<!DOCTYPE peripheralPage SYSTEM "_menu.dtd" >
<!-- spi0_16bit_mkl.xml -->

<peripheralPage xmlns:xi="http://www.w3.org/2001/XInclude" name="_instance" description="Serial Peripheral Interface">

   <xi:include href="_default_instance.xml"/>

   <xi:include href="_mapPinsOption_on.xml"/>
   
   <intOption name="speed" 
      description="Speed of interface"
      toolTip="Speed of transmission"
      value="10000000" units="Hz"
      min="0" max="10000000" />

   <choiceOption name="spi_mode"  
      description="Mode"
      toolTip="Communication mode">
      <choice value="0" name="Mode 0: CPOL=0, CPHA=0" isDefault="true" />
      <choice value="1" name="Mode 1: CPOL=0, CPHA=1" />
      <choice value="2" name="Mode 2: CPOL=1, CPHA=0" />
      <choice value="3" name="Mode 3: CPOL=1, CPHA=1" />
   </choiceOption>

   <binaryOption name="spi_lsbfe" 
      description="Transmission order"
      toolTip="Transmission order">
      <choice value="0" name="MSB first" />
      <choice value="1" name="LSB first" />
   </binaryOption>
      
   <projectActionList id = "spi_files" >
      <copy source="Project_Headers/spi_16bit-MKL.h"    target="Project_Headers/spi.h"  overwrite="true"  derived="true" />
      <copy source="Sources/spi_16bit-MKL.cpp"          target="Sources/spi.cpp"        overwrite="true"  derived="true" />
   </projectActionList>
   
   <xi:include href="_irqOption.xml"/>
   
   <xi:include href="_clockOption.xml"/>
   
   <validate
      class="net.sourceforge.usbdm.deviceEditor.validators.SpiValidate">
   </validate>

   <template><![CDATA[
      \t//! Default communication mode: order, clock phase and clock polarity
      \tstatic constexpr uint8_t modeValue = 
      \t   SPI_C1_LSBFE($(spi_lsbfe))| // LSB or MSB first
      \t   SPI_C1_MODE($(spi_mode));  // Mode (CPOL+CPHA)
      
      \tstatic uint32_t getClockFrequency() {
      \t   return SystemBusClock;
      \t}

      \t//! Default speed (Hz)\n
      \tstatic constexpr uint32_t speed = 
      \t   $(speed);\n\n
   ]]></template>

   <signals/>
</peripheralPage>
