<?xml version="1.0" encoding="UTF-8"?>
<!DOCTYPE peripheralPage SYSTEM "_menu.dtd" >
<!-- _usb_def_clkrcv.xml -->

<peripheralPage xmlns:xi="http://www.w3.org/2001/XInclude" name="_instance" description="USB">

   <xi:include href="_default_instance.xml"/>
   <xi:include href="_mapPinsOption_on.xml"/>

   <aliasOption key="/SIM/system_usb_clkin_clock"     constant="false" optional="true"/>
   
   <for keys="n" dim="/SIM/numberOfClockSettings" >
      <aliasCategoryOption key="/MCG/ClockConfig[%(n)]"           constant="true" >
         <aliasOption key="/SIM/system_peripheral_clock[%(n)]"    constant="true" optional="true"/>
         <aliasOption key="/SIM/sim_sopt2_usbsrc[%(n)]"           constant="false" optional="true"/>
         <aliasOption key="/SIM/sim_clkdiv2_usb[%(n)]"            constant="false" optional="true"/>
         <aliasOption key="/SIM/system_usbfs_clock[%(n)]"         optional="true"/>
      </aliasCategoryOption>
   </for>
   
   <choiceOption key="usb_clk_enable" 
      enumStem="UsbIrc48mClockEnable"
      valueFormat="(%s)"
      description="IRC48M enable"
      toolTip="Enables the IRC48M clock as a clock source for FS USB">
      <choice value="USB_CLK_RECOVER_IRC_EN_IRC_EN(0)"  enum="Peripheral"       name="Not available"  isDefault="true"  />
      <choice value="USB_CLK_RECOVER_IRC_EN_IRC_EN(1)"  enum="PeripheralAndUsb" name="Available as USB clock"  />
   </choiceOption>
      
   <xi:include href="_usb_base_clkrcv.xml"/>

   <xi:include href="_irqOption.xml"/>
   
   <xi:include href="_clockOption.xml"/>
   
   <xi:include href="_usb_base_files.xml"/>

   <signals/>
</peripheralPage>
