<?xml version="1.0" encoding="UTF-8"
?>
<!DOCTYPE peripheralPage SYSTEM "_menu.dtd" >
<!-- llwu_pe4_filt2_base.xml -->

<fragment xmlns:xi="http://www.w3.org/2001/XInclude">


   <xi:include href="_default_instance.xml"/>
   
   <xi:include href="_mapPinsOption.xml"/>   

   <choiceOption name="llwu_pe1_wupe_t" hidden="true" 
      description="Wakeup Pin Enable" 
      toolTip="Enables and configures the edge detection for the wakeup pin">
      <choice name="Disabled" value="0" isDefault="true" /> 
      <choice name="Rising"   value="1" /> 
      <choice name="Falling"  value="2" /> 
      <choice name="Either"   value="3" />
   </choiceOption>   
   <choiceOption name="llwu_pe1_wupe0" derivedFrom="llwu_pe1_wupe_t"/>
   <choiceOption name="llwu_pe1_wupe1" derivedFrom="llwu_pe1_wupe_t"/>
   <choiceOption name="llwu_pe1_wupe2" derivedFrom="llwu_pe1_wupe_t"/>
   <choiceOption name="llwu_pe1_wupe3" derivedFrom="llwu_pe1_wupe_t"/>

   <template><![CDATA[
      \t// LLWU Pin Enable registers
      \tstatic constexpr uint8_t pe1 = 
      \t   LLWU_PE1_WUPE0($(llwu_pe1_wupe0))|   // LLWUP 0
      \t   LLWU_PE1_WUPE1($(llwu_pe1_wupe1))|   // LLWUP 1
      \t   LLWU_PE1_WUPE2($(llwu_pe1_wupe2))|   // LLWUP 2
      \t   LLWU_PE1_WUPE3($(llwu_pe1_wupe3));   // LLWUP 3 \n\n
   ]]></template>

   <choiceOption name="llwu_pe2_wupe4" derivedFrom="llwu_pe1_wupe_t"/>
   <choiceOption name="llwu_pe2_wupe5" derivedFrom="llwu_pe1_wupe_t"/>
   <choiceOption name="llwu_pe2_wupe6" derivedFrom="llwu_pe1_wupe_t"/>
   <choiceOption name="llwu_pe2_wupe7" derivedFrom="llwu_pe1_wupe_t"/>

   <template><![CDATA[
      \tstatic constexpr uint8_t pe2 = 
      \t   LLWU_PE2_WUPE4($(llwu_pe2_wupe4))|   // LLWUP 4
      \t   LLWU_PE2_WUPE5($(llwu_pe2_wupe5))|   // LLWUP 5
      \t   LLWU_PE2_WUPE6($(llwu_pe2_wupe6))|   // LLWUP 6
      \t   LLWU_PE2_WUPE7($(llwu_pe2_wupe7));   // LLWUP 7 \n\n
   ]]></template>

   <choiceOption 
      name="llwu_filt1_filte" 
      description="Digital Filter 1 On External Pin"  
      toolTip="Controls the digital filter options for the external pin detect.">
      
      <choice name="Filter disabled" value="0" isDefault="true" />
      <choice name="Filter rising"   value="1" />
      <choice name="Filter falling"  value="2" />
      <choice name="Filter both"     value="3" />
   </choiceOption>   
   
   <intOption 
      name="llwu_filt1_filtsel" 
      description="Filter 1 Pin Select" 
      toolTip="Selects 1 of the external signals to be muxed into the filter"
      min="0" max="15" />
      
   <template><![CDATA[
      \t// Pin Filter 1 register
      \tstatic constexpr uint8_t filt1 = 
      \t   LLWU_FILT_FILTE($(llwu_filt1_filte)) |   // Digital Filter On External Pin
      \t   LLWU_FILT_FILTSEL($(llwu_filt1_filtsel));  // Filter Pin Select\n\n
   ]]></template>
      
   <choiceOption 
      name="llwu_filt2_filte" 
      description="Digital Filter 2 On External Pin"  
      toolTip="Controls the digital filter options for the external pin detect.">
      
      <choice name="Filter disabled" value="0" isDefault="true" />
      <choice name="Filter rising"   value="1" />
      <choice name="Filter falling"  value="2" />
      <choice name="Filter both"     value="3" />
   </choiceOption>   
   
   <intOption 
      name="llwu_filt2_filtsel" 
      description="Filter 2 Pin Select" 
      toolTip="Selects 1 of the external signals to be muxed into the filter"
      min="0" max="15" />

   <template><![CDATA[
      \t// Pin Filter 2 register
      \tstatic constexpr uint8_t filt2 =
      \t   LLWU_FILT_FILTE($(llwu_filt2_filte)) |   // Digital Filter On External Pin
      \t   LLWU_FILT_FILTSEL($(llwu_filt2_filtsel));  // Filter Pin Select\n\n
   ]]></template>
      
         
</fragment>
